{
  "file_type": "reference_text_file",
  "reference_text_id": "REF-MIM-MIMAMSASUTRA",
  "subject_id": "mimamsa",
  "title": "Mimamsa Sutra",
  "author_or_tradition": "Jaimini tradition",
  "language": "sa",
  "edition_note": "Pilot passages and grader notes only. Verify against the edition and commentary tradition you choose before public release.",
  "passages": [
    {
      "passage_id": "REF-MIM-MIMAMSASUTRA:S1.1.1",
      "locator": "1.1.1",
      "text": "athāto dharmajijñāsā",
      "translation_or_note": "Now, therefore, inquiry into dharma.",
      "grader_use": "Use for questions about the opening inquiry into dharma."
    },
    {
      "passage_id": "REF-MIM-MIMAMSASUTRA:S1.1.2",
      "locator": "1.1.2",
      "text": "codanālakṣaṇo'rtho dharmaḥ",
      "translation_or_note": "Dharma is the object characterized by Vedic injunction.",
      "grader_use": "Use for grading source-grounded answers about dharma, injunction, and limits of ordinary pramanas."
    },
    {
      "passage_id": "REF-MIM-MIMAMSASUTRA:GRADER-NOTE-VIDHI-ARTHAVADA",
      "locator": "grader-note-vidhi-arthavada",
      "text": "Mimamsa interpretation distinguishes injunctive passages from explanatory, narrative, praise, and blame passages, while often using the latter to support the force and application of injunctions.",
      "translation_or_note": "This is a compact grader note, not a sutra quotation.",
      "grader_use": "Use for grading vidhi and arthavada distinctions."
    },
    {
      "passage_id": "REF-MIM-MIMAMSASUTRA:GRADER-NOTE-APURVA",
      "locator": "grader-note-apurva",
      "text": "Apurva is used in Mimamsa ritual theory to account for an unseen efficacy generated by ritual action that connects the act to a later result.",
      "translation_or_note": "This is a compact grader note, not a sutra quotation.",
      "grader_use": "Use for grading questions about ritual causality and unseen results."
    },
    {
      "passage_id": "REF-MIM-MIMAMSASUTRA:GRADER-NOTE-HERMENEUTICS",
      "locator": "grader-note-hermeneutics",
      "text": "Before accepting contradiction, Mimamsa interpretation tests sentence connection, context, indicatory marks, proximity, repetition, naming, primary and secondary meaning, and the functional class of each passage.",
      "translation_or_note": "This is a compact grader note, not a sutra quotation.",
      "grader_use": "Use for grading applied hermeneutic reasoning."
    }
  ]
}

